[
  {
    "metadata": {
      "review_status": "Reviewed",
      "last_scientific_review": "2026-06-26",
      "content_quality": "High",
      "difficulty_level": "Intermediate"
    },
    "disease_id": "STRAWBERRY_001",
    "disease_name": "Leaf_Scorch",
    "common_name": "Leaf Scorch",
    "scientific_name": "Diplocarpon earlianum",
    "crop": "Strawberry",
    "disease_type": "Fungal",
    "pathogen_type": "Fungus",
    "overview": {
      "description": "Leaf Scorch is a common foliar disease of strawberries. It causes dark purple to brown blotches on the leaves that rapidly merge together, making the leaf look burned or 'scorched'. While it doesn't rot the fruit, severe infections stunt the plant and drastically reduce the next year's yield.",
      "importance": "Medium to High. Heavy infections in late summer or fall reduce the plant's ability to store carbohydrates in the crown, leading to poor winter survival and reduced blossom production the following spring.",
      "affected_parts": [
        "Leaves",
        "Petioles",
        "Runners",
        "Calyx (fruit cap)"
      ],
      "host_plants": [
        "Strawberry"
      ]
    },
    "symptoms": {
      "early": [
        "Small (1/8 inch), irregular, purplish-dark brown spots appear on the upper surfaces of the leaves.",
        "Unlike Common Leaf Spot, these spots NEVER develop a white or light-gray dead center."
      ],
      "moderate": [
        "The dark spots rapidly expand and merge (coalesce) into large, irregular purplish-brown blotches.",
        "Tiny, shiny black fruiting bodies (acervuli) may be visible in the dark lesions with a hand lens.",
        "The tissue around the spots turns yellow or bright red."
      ],
      "severe": [
        "The entire leaf dries up, curls at the edges, turns completely brown, and looks as though it was burned by fire (scorched).",
        "The calyx (the green leafy cap on the strawberry) turns brown and dies, severely reducing the market value of the fruit.",
        "Plant vigor drops completely."
      ],
      "leaf": [
        "Solid, irregular purplish-brown blotches without a white center, merging to kill the entire leaf (scorched look)."
      ],
      "stem": [
        "Petioles and runners develop elongated, slightly sunken purple streaks."
      ],
      "fruit": [
        "Fruit is rarely infected directly, but the green calyx (cap) turns brown and dies (dead cap)."
      ],
      "flower": [
        "Can occasionally infect flower petals."
      ],
      "root": []
    },
    "causes": {
      "primary_cause": "Fungal spores splashing from infected dead leaves in the plant canopy onto healthy foliage.",
      "pathogen": "Diplocarpon earlianum",
      "survival_mechanism": "Overwinters successfully in infected dead or living leaves that remain attached to the strawberry crown throughout the winter.",
      "infection_process": "Spring rains trigger the overwintering fruiting bodies to release ascospores. The spores require the leaf to remain wet for several hours to germinate and penetrate the cuticle. Lesions are visible within 2 weeks."
    },
    "infection_cycle": {
      "stages": [
        "Overwintering in old foliage.",
        "Spring rains splash spores to new, expanding leaves.",
        "Incubation (10-14 days).",
        "Secondary spread: Lesions produce conidia that splash to other leaves during every summer rainstorm."
      ],
      "spread_cycle": "Polycyclic. Constant secondary spread occurs from spring through late autumn as long as foliage gets wet."
    },
    "transmission": {
      "methods": [
        "Rain splash",
        "Overhead irrigation",
        "Contaminated tools/workers moving through wet fields"
      ],
      "vectors": [],
      "common_sources": [
        "Dead foliage from the previous season left in the strawberry bed"
      ]
    },
    "risk_factors": {
      "humidity": "High",
      "rainfall": "High",
      "poor_airflow": "High",
      "overhead_irrigation": "Extreme",
      "dense_canopy": "Medium"
    },
    "environmental_conditions": {
      "temperature": {
        "optimal_range": "15°C - 25°C (59°F - 77°F)",
        "notes": "Prefers moderate, cool-to-warm temperatures. Hot weather (above 86°F) generally suppresses the fungus."
      },
      "humidity": {
        "optimal_range": "85% - 100%",
        "notes": "Required for the fungal fruiting bodies to produce spores."
      },
      "rainfall": "Frequent rain showers or heavy dews are the absolute drivers of the disease, providing the splash necessary to move the sticky spores.",
      "wind": "Dries out the canopy, ending the infection period.",
      "soil_conditions": "Not directly applicable, but dense weed growth prevents the canopy from drying.",
      "leaf_wetness": "Requires 9 to 12 hours of continuous leaf wetness to establish an infection."
    },
    "weather_thresholds": {
      "temperature": {
        "min": 10,
        "max": 30
      },
      "humidity": {
        "min": 85,
        "max": 100
      },
      "leaf_wetness_hours_min": 9
    },
    "weather_influence": {
      "high_humidity": "Extends the leaf wetness period, ensuring the spores have enough time to germinate.",
      "rain": "The primary dispersal agent. No rain splash = no spread.",
      "high_temperature": "High summer heat pauses the disease, but it will flare back up in the cooler, wetter autumn weather.",
      "low_temperature": "Slows disease progression.",
      "wind": "Dries the leaves quickly, reducing infection.",
      "dry_conditions": "Halts the disease completely. The pathogen cannot spread or infect without water."
    },
    "severity_levels": {
      "low": "Scattered purplish blotches on the oldest leaves. Normal in most perennial beds.",
      "medium": "Blotches moving to newer leaves; petioles showing streaks. Protectant spray required.",
      "high": "Leaves beginning to curl and turn entirely brown. Calyces on fruit turning brown.",
      "critical": "Severe defoliation ('scorched earth' look) in late summer/fall. Plant crowns failing to size up for winter."
    },
    "severity_score": {
      "low": 1,
      "medium": 2,
      "high": 3,
      "critical": 4
    },
    "immediate_actions": {
      "today": [
        "If plants are blooming or setting fruit, apply a protectant fungicide immediately before the next rain event to protect the calyx (fruit cap)."
      ],
      "within_24_hours": [
        "Switch all irrigation from overhead sprinklers to drip tape immediately."
      ],
      "within_one_week": [
        "If the harvest is over (June-bearing varieties), immediately mow the leaves off the plants (renovation) and remove the debris from the field."
      ]
    },
    "treatment": {
      "chemical": [
        "Captan, Mancozeb (Excellent broad-spectrum protectants).",
        "Myclobutanil, Thiophanate-methyl (Systemic options to halt spread)."
      ],
      "biological": [
        "Bacillus subtilis can offer mild preventative suppression under low disease pressure."
      ],
      "organic": [
        "Copper formulations (Can cause some leaf burn if applied during hot weather).",
        "Strict renovation (mowing) and sanitation."
      ],
      "integrated_management": [
        "Combine resistant varieties with a strict post-harvest renovation (mowing off all old foliage) to break the disease cycle entirely."
      ]
    },
    "prevention": {
      "farm_hygiene": [
        "RENOVATION: For June-bearing strawberries, mow the foliage 1-2 inches above the crown immediately after harvest and rake/destroy the debris. This removes the fungal inoculum.",
        "Remove dead leaves in the spring before new growth begins."
      ],
      "irrigation": [
        "Use drip irrigation. Overhead watering guarantees the spread of Leaf Scorch."
      ],
      "crop_rotation": [
        "Rotating to a new bed every 3-4 years breaks the buildup of inoculum."
      ],
      "air_circulation": [
        "Maintain proper plant spacing (don't let runner plants choke the bed) and control all weeds to ensure rapid drying."
      ],
      "resistant_varieties": [
        "Highly recommended. Cultivars like 'Jewel', 'Allstar', and 'Surecrop' have good resistance. 'Honeoye' and 'Chandler' are highly susceptible."
      ],
      "seasonal_practices": [
        "Apply a late-summer/early-fall fungicide spray to protect the new foliage so the plant can store energy for winter."
      ]
    },
    "nutrient_management": {
      "nitrogen": "Avoid excess spring nitrogen, which creates a dense, slow-drying canopy.",
      "phosphorus": "Standard.",
      "potassium": "Standard.",
      "calcium": "Standard.",
      "magnesium": "Standard.",
      "micronutrients": []
    },
    "disease_progression": {
      "untreated": [
        "Spring rains splash spores to new leaves.",
        "Solid purple blotches form and merge.",
        "Leaves die and look scorched by mid-summer.",
        "Plants fail to store carbohydrates in autumn.",
        "Winter kill increases; next year's yield drops 30-50%."
      ],
      "treated": [
        "Post-harvest mowing removes the infection source.",
        "Protectant sprays shield the new autumn leaves.",
        "Plants remain green, store energy, and produce heavily the following spring."
      ]
    },
    "recovery_indicators": [
      "The newest flush of leaves emerging from the crown remains bright green without purple blotches.",
      "The green calyces (caps) on developing fruit remain healthy and green."
    ],
    "recovery": {
      "estimated_days": "14-21",
      "success_rate": "High",
      "depends_on": [
        "Renovation (Mowing)",
        "Dry Weather",
        "Fungicide Protection"
      ]
    },
    "economic_impact": {
      "yield_loss": "Minor in the current year, but can cause 30-50% yield loss the *following* year due to starved crowns.",